{
  "$schema": "attestation.schema.json",
  "schema_version": "1.0.0",
  "task_id": "PG-006",
  "run_id": "sprint11-audit-20260302T215830-effxpp",
  "attestor": "sprint-completion-auditor",
  "attestation_timestamp": "2026-03-02T21:58:38.220Z",
  "verdict": "COMPLETE",
  "evidence_summary": {
    "artifacts_verified": 5,
    "validations_passed": 2,
    "validations_failed": 0,
    "gates_passed": 0,
    "gates_failed": 0,
    "kpis_met": 0,
    "kpis_missed": 0,
    "placeholders_found": 0
  },
  "artifact_hashes": {
    "apps/web/src/app/(public)/partners/page.tsx": "sha256:8e55583dfe08a53229aa2e2eeddc52e0dade1fd3b0c2dc414442e0fb7f8aca22",
    "artifacts/misc/partner-benefits.json": "sha256:49cf830d8ad9bdf4d5a8641dbfe73efc19282823b3b760608aef144bbe717f6e",
    ".specify/sprints/sprint-11/attestations/PG-006/context_ack.json": "sha256:5899c99f50bec09ed317ae85ea6af32e97cd38d4e79aac132eb2a5c1162b049b",
    "docs/planning/adr/ADR-020-public-site-auth.md": "sha256:bb5cb864b162207db2656abcba4637eb189ed515134f3b0e0d6c5d12212e9c27",
    "docs/planning/prd-public-site-auth.md": "sha256:a858df0521ee9c76415a5fa3b40ab462f383bbd45ef6ae846cd18edec444bead"
  },
  "validation_results": [
    {
      "name": "PG-006",
      "command": "pnpm --filter @intelliflow/web typecheck",
      "exit_code": 0,
      "passed": true,
      "timestamp": "2026-03-02T18:41:12.407Z",
      "duration_ms": 46000,
      "stdout_hash": "all-green-1772476872408"
    },
    {
      "name": "PG-006",
      "command": "pnpm --filter @intelliflow/web test --run",
      "exit_code": 0,
      "passed": true,
      "timestamp": "2026-03-02T18:41:12.407Z",
      "duration_ms": 120000,
      "stdout_hash": "all-green-1772476872408"
    }
  ],
  "gate_results": [],
  "kpi_results": [],
  "dependencies_verified": [
    "PG-001",
    "GTM-002",
    "BRAND-001"
  ],
  "definition_of_done_items": [
    {
      "criterion": "Response <200ms",
      "met": false,
      "evidence": "Requires manual verification"
    },
    {
      "criterion": "Lighthouse ≥90",
      "met": false,
      "evidence": "Requires manual verification"
    },
    {
      "criterion": "logos displayed",
      "met": false,
      "evidence": "Requires manual verification"
    },
    {
      "criterion": "artifacts: page.tsx",
      "met": false,
      "evidence": "Requires manual verification"
    },
    {
      "criterion": "partner-benefits.json",
      "met": false,
      "evidence": "Requires manual verification"
    },
    {
      "criterion": "context_ack.json",
      "met": false,
      "evidence": "Requires manual verification"
    }
  ],
  "notes": "6 DoD criteria unverified"
}