{
  "$schema": "attestation.schema.json",
  "schema_version": "1.0.0",
  "task_id": "PG-024",
  "run_id": "sprint13-audit-20260302T215849-ygkkim",
  "attestor": "sprint-completion-auditor",
  "attestation_timestamp": "2026-03-02T21:58:57.350Z",
  "verdict": "COMPLETE",
  "evidence_summary": {
    "artifacts_verified": 4,
    "validations_passed": 2,
    "validations_failed": 0,
    "gates_passed": 0,
    "gates_failed": 0,
    "kpis_met": 0,
    "kpis_missed": 0,
    "placeholders_found": 0
  },
  "artifact_hashes": {
    "apps/web/src/app/(public)/auth/callback/page.tsx": "sha256:d89f2379e175fe5c7d1abf65f79758a543e3642d28a30dff56d6833157a468a2",
    "apps/web/src/components/shared/oauth-callback.tsx": "sha256:dea6217125b3917ca29ebf046459e8545afb3c4cd66ac2a26b899e417f9166be",
    "apps/web/src/lib/shared/token-exchange.ts": "sha256:94dc5a382dcbe26595efb36d92334ab9cf07d685a4e56fb185c7295ca4a53019",
    ".specify/sprints/sprint-13/attestations/PG-024/attestation.json": "sha256:dd1b9be2a0a3fd43ca774e0cc0dd4c081e0e167663e1ed9727613513567e3c7a"
  },
  "validation_results": [
    {
      "name": "PG-024",
      "command": "pnpm --filter @intelliflow/web typecheck",
      "exit_code": 0,
      "passed": true,
      "timestamp": "2026-03-02T18:41:12.407Z",
      "duration_ms": 46000,
      "stdout_hash": "all-green-1772476872408"
    },
    {
      "name": "PG-024",
      "command": "pnpm --filter @intelliflow/web test --run",
      "exit_code": 0,
      "passed": true,
      "timestamp": "2026-03-02T18:41:12.407Z",
      "duration_ms": 120000,
      "stdout_hash": "all-green-1772476872408"
    }
  ],
  "gate_results": [],
  "kpi_results": [],
  "dependencies_verified": [
    "PG-015",
    "IFC-006"
  ],
  "definition_of_done_items": [
    {
      "criterion": "Response <200ms",
      "met": false,
      "evidence": "Requires manual verification"
    },
    {
      "criterion": "Lighthouse ≥90",
      "met": false,
      "evidence": "Requires manual verification"
    },
    {
      "criterion": "SSO complete",
      "met": false,
      "evidence": "Requires manual verification"
    },
    {
      "criterion": "artifacts: page.tsx",
      "met": false,
      "evidence": "Requires manual verification"
    },
    {
      "criterion": "oauth-callback.tsx",
      "met": false,
      "evidence": "Requires manual verification"
    },
    {
      "criterion": "token-exchange.ts",
      "met": false,
      "evidence": "Requires manual verification"
    }
  ],
  "notes": "6 DoD criteria unverified"
}