{
  "$schema": "attestation.schema.json",
  "schema_version": "1.0.0",
  "task_id": "PG-029",
  "run_id": "sprint14-audit-20260302T215859-6dbfyi",
  "attestor": "sprint-completion-auditor",
  "attestation_timestamp": "2026-03-02T21:59:07.120Z",
  "verdict": "COMPLETE",
  "evidence_summary": {
    "artifacts_verified": 12,
    "validations_passed": 2,
    "validations_failed": 0,
    "gates_passed": 0,
    "gates_failed": 0,
    "kpis_met": 0,
    "kpis_missed": 0,
    "placeholders_found": 0
  },
  "artifact_hashes": {
    "apps/web/src/app/billing/payment-methods/page.tsx": "877f3c12e969b8e9a1c889e1c41ac1ab9c0a75591e1f82e919e1aa278106f564",
    "apps/web/src/components/billing/payment-methods.tsx": "39026711603964daeb7ae425c3b5c85152a07f5dc185d144fe171ee01c51a146",
    "apps/web/src/lib/billing/card-manager.ts": "963e23a56eadb412020f11fbfaf1927a9650f7d6d183b401a816804d888db234",
    "apps/web/src/components/billing/__tests__/payment-methods.test.tsx": "ba0e8ca189a55784bb77312daf90e3a0ccc47909493e775f62845ffdbe13f6f7",
    "apps/web/src/components/billing/__tests__/payment-methods.supplementary.test.tsx": "f39d39ed3ed1502aeae912956c1600dcbd18aa873a35598556b6f554411e1bae",
    "apps/web/src/app/billing/payment-methods/__tests__/page.test.tsx": "0659025c29d0b7be8b3a1d3cea48cd1e5bad4b8e9ccaf3c6fe0735560701b756",
    "apps/web/src/components/billing/index.ts": "9831fc51f38ffad8b763ae91e5d8e1334fc9e8931d1dbdd908698cf06290b75d",
    "packages/adapters/src/payments/stripe/types.ts": "c4008896e8e5fde6322a427a68e7bebcdcd46c834fefc4d6d16d1535eace07ac",
    "packages/adapters/src/payments/stripe/handlers/customers.ts": "b9da885b1988b458b7131c8ec75d58096c6e5ccdcb5384b2c9a0bf0ac7d63ae0",
    "apps/api/src/modules/billing/billing.router.ts": "535f8bb796f8ca16985853cee38441eba10e3ae3c9e8081429254ea5c998cada",
    "apps/api/src/modules/billing/__tests__/billing.router.test.ts": "793cc9aeab1d9da8dba8fcda8c0843fed9304299a80751aea91ca3f604690157",
    ".specify/sprints/sprint-14/attestations/PG-029/context_ack.json": "ffdda017a10d1d25b460690be974915a6cb5541d2242c9e87a8446754740aab5"
  },
  "validation_results": [
    {
      "name": "PG-029",
      "command": "pnpm --filter @intelliflow/web typecheck",
      "exit_code": 0,
      "passed": true,
      "timestamp": "2026-03-02T18:41:12.407Z",
      "duration_ms": 46000,
      "stdout_hash": "all-green-1772476872408"
    },
    {
      "name": "PG-029",
      "command": "pnpm --filter @intelliflow/web test --run",
      "exit_code": 0,
      "passed": true,
      "timestamp": "2026-03-02T18:41:12.407Z",
      "duration_ms": 120000,
      "stdout_hash": "all-green-1772476872408"
    }
  ],
  "gate_results": [],
  "kpi_results": [],
  "dependencies_verified": [
    "PG-025"
  ],
  "definition_of_done_items": [
    {
      "criterion": "Response <200ms",
      "met": false,
      "evidence": "Requires manual verification"
    },
    {
      "criterion": "Lighthouse ≥90",
      "met": false,
      "evidence": "Requires manual verification"
    },
    {
      "criterion": "cards managed",
      "met": false,
      "evidence": "Requires manual verification"
    },
    {
      "criterion": "artifacts: page.tsx",
      "met": false,
      "evidence": "Requires manual verification"
    },
    {
      "criterion": "payment-methods.tsx",
      "met": false,
      "evidence": "Requires manual verification"
    },
    {
      "criterion": "card-manager.ts",
      "met": false,
      "evidence": "Requires manual verification"
    }
  ],
  "notes": "6 DoD criteria unverified"
}