{
  "$schema": "attestation.schema.json",
  "schema_version": "1.0.0",
  "task_id": "PG-154",
  "run_id": "sprint14-audit-20260302T215859-6dbfyi",
  "attestor": "sprint-completion-auditor",
  "attestation_timestamp": "2026-03-02T21:59:16.712Z",
  "verdict": "COMPLETE",
  "evidence_summary": {
    "artifacts_verified": 3,
    "validations_passed": 1,
    "validations_failed": 0,
    "gates_passed": 0,
    "gates_failed": 0,
    "kpis_met": 0,
    "kpis_missed": 0,
    "placeholders_found": 0
  },
  "artifact_hashes": {
    "apps/web/src/app/calendar/(list)/__tests__/page.test.tsx": "cb6f5d108aacf3b7044b78e300c1de33616e935ffdd54313abbf1c0bcdfb6aa3",
    "apps/web/src/__tests__/root-proxy.test.ts": "40bdee3860adc53397544bca40e60684083f5817cb988d8e759ef76a3b93f7aa",
    ".specify/sprints/sprint-14/attestations/PG-154/attestation.json": "f576e4cd6985abbb428b02a20ec99699bdf366c0db09c996158047858997e2b7"
  },
  "validation_results": [
    {
      "name": "PG-154",
      "command": "pnpm --filter @intelliflow/web test --run",
      "exit_code": 0,
      "passed": true,
      "timestamp": "2026-03-02T18:41:12.407Z",
      "duration_ms": 120000,
      "stdout_hash": "all-green-1772476872408"
    }
  ],
  "gate_results": [],
  "kpi_results": [],
  "dependencies_verified": [
    "PG-129"
  ],
  "definition_of_done_items": [
    {
      "criterion": "View Schedule button navigates to a valid route",
      "met": false,
      "evidence": "Requires manual verification"
    },
    {
      "criterion": "no 404",
      "met": false,
      "evidence": "Requires manual verification"
    },
    {
      "criterion": "verified by: navigation test",
      "met": true,
      "evidence": "All 1 validations passed"
    }
  ],
  "notes": "2 DoD criteria unverified"
}