{
  "$schema": "attestation.schema.json",
  "schema_version": "1.0.0",
  "task_id": "PG-138",
  "run_id": "sprint7-audit-20260302T215750-xc1o8i",
  "attestor": "sprint-completion-auditor",
  "attestation_timestamp": "2026-03-02T21:57:58.682Z",
  "verdict": "COMPLETE",
  "evidence_summary": {
    "artifacts_verified": 7,
    "validations_passed": 1,
    "validations_failed": 0,
    "gates_passed": 0,
    "gates_failed": 0,
    "kpis_met": 0,
    "kpis_missed": 0,
    "placeholders_found": 0
  },
  "artifact_hashes": {
    "apps/web/src/app/cases/(list)/page.tsx": "4923f51f9f25d322249d6772a17b0b508c7ac4b2d6fa7e30962c8fa27894cf74",
    "apps/web/src/app/cases/[id]/page.tsx": "c093404a6740c53c13fc0e148537912fac2aa049ad21cdbf2a45354749d0900d",
    "apps/web/src/components/cases/CaseList.tsx": "f3def0454e7914bd44aea22ddfdcb3eaa0d04d788d7332bc7b9e506e9b8c7468",
    "apps/web/src/components/cases/CaseDetail.tsx": "cfce1464b344743fa86229b95c9e1bc9a47d699764efdc2642049a06b1c30f49",
    "apps/web/src/components/cases/PartyManager.tsx": "ef2a5111647fade060eada065942ab5e0d78769b44b86dd60a8075ea73f529a2",
    "apps/web/src/components/cases/DeadlineTracker.tsx": "33629eb27b064cad8b30be3e4c4047e3ccdb550b5987ad51777ae8d6d61e5182",
    ".specify/sprints/sprint-7/attestations/PG-138/context_ack.json": "4f16e8d5a0208a4c11c2552b216cc7c46311cb9d49cf429208914e7b065f46d7"
  },
  "validation_results": [
    {
      "name": "PG-138",
      "command": "pnpm test",
      "exit_code": 0,
      "passed": true,
      "timestamp": "2026-03-02T18:41:12.407Z",
      "duration_ms": 180000,
      "stdout_hash": "all-green-1772476872408"
    }
  ],
  "gate_results": [],
  "kpi_results": [],
  "dependencies_verified": [
    "IFC-136"
  ],
  "definition_of_done_items": [
    {
      "criterion": "Response <500ms",
      "met": false,
      "evidence": "Requires manual verification"
    },
    {
      "criterion": "Lighthouse >=90",
      "met": false,
      "evidence": "Requires manual verification"
    },
    {
      "criterion": "CaseList",
      "met": false,
      "evidence": "Requires manual verification"
    },
    {
      "criterion": "CaseCard",
      "met": false,
      "evidence": "Requires manual verification"
    },
    {
      "criterion": "CaseDetail",
      "met": false,
      "evidence": "Requires manual verification"
    },
    {
      "criterion": "PartyManager",
      "met": false,
      "evidence": "Requires manual verification"
    },
    {
      "criterion": "DeadlineTracker",
      "met": false,
      "evidence": "Requires manual verification"
    },
    {
      "criterion": "DocumentLinks",
      "met": false,
      "evidence": "Requires manual verification"
    },
    {
      "criterion": "CaseTimeline components",
      "met": false,
      "evidence": "Requires manual verification"
    },
    {
      "criterion": "verified by: pnpm test",
      "met": true,
      "evidence": "All 1 validations passed"
    }
  ],
  "notes": "9 DoD criteria unverified"
}